{"active_behavior_authorization":false,"content_sha256":"b3481f850e9039057fe7b6d73819803b1d61f6ff630f06d6f633f946371ee971","document_id":"workload_shape.requested.run.factor_onboarding.queued_send.single_datagram","document_version":1,"payload":{"concurrency":1,"operation_count":5,"payload_bytes":11840,"shape_kind":"requested","workload_archetype_id":"send_composition_independent_correctness_harness","workload_instance_id":"workload.run.factor_onboarding.queued_send.single_datagram"},"performance_acceptance_authorization":false,"schema_version":"adaptive-runtime-workload-shape-v1","trace_references":{"architecture_ids":["ARC-QUIC-CRT-0113"],"requirement_ids":["REQ-QUIC-CRT-0235","REQ-QUIC-CRT-0236","REQ-QUIC-CRT-0237","REQ-QUIC-CRT-0238","REQ-QUIC-CRT-0239","REQ-QUIC-CRT-0240"],"verification_ids":["VER-QUIC-CRT-0115"],"work_item_ids":["WI-QUIC-CRT-0114"]}}