{"active_behavior_authorization":false,"content_sha256":"d8a2b0188fc3de7744ead847ec547d537e9961808eecff3bedef4041cbd8c236","document_id":"workload_shape.requested.run.send_composition.correctness","document_version":1,"payload":{"concurrency":1,"operation_count":11,"payload_bytes":400,"shape_kind":"requested","workload_archetype_id":"send_composition_correctness_harness","workload_instance_id":"workload.run.send_composition.correctness"},"performance_acceptance_authorization":false,"schema_version":"adaptive-runtime-workload-shape-v1","trace_references":{"architecture_ids":["ARC-QUIC-CRT-0107"],"requirement_ids":["REQ-QUIC-CRT-0223","REQ-QUIC-CRT-0224","REQ-QUIC-CRT-0225","REQ-QUIC-CRT-0226","REQ-QUIC-CRT-0227","REQ-QUIC-CRT-0228"],"verification_ids":["VER-QUIC-CRT-0109"],"work_item_ids":["WI-QUIC-CRT-0108"]}}