{"active_behavior_authorization":false,"content_sha256":"c605ab41d2f306ebf5d6193a14ff050d04764693244df248d7541f8e896d4efb","document_id":"artifact_inventory.run.batch.single_eligible.candidate.reviewed_80113e61","document_version":1,"payload":{"artifacts":[{"document_ref":{"document_id":"adaptive_runtime_experiment_plan_batch_actuation_v1","schema_version":"adaptive-runtime-experiment-plan-v1","document_version":1,"content_sha256":"2d5e91529b0ad4e2c013feddf6db1dcf3fddc6e1c22b078b0865ead417f99e4f"},"role":"experiment_plan"},{"document_ref":{"document_id":"binary_cohort.run.batch.single_eligible.candidate.reviewed_80113e61","schema_version":"adaptive-runtime-binary-cohort-v1","document_version":1,"content_sha256":"3073425bd650b81e2a30497966da74833b15b62d49005f8b4c68e949c480e59d"},"role":"binary_cohort"},{"document_ref":{"document_id":"classifications.run.batch.single_eligible.candidate.reviewed_80113e61","schema_version":"adaptive-runtime-classification-set-v1","document_version":1,"content_sha256":"b7882680ab8f6a4f61158488635b9593ec18e1bfae2915108a49ad480d2ad7ed"},"role":"classifications"},{"document_ref":{"document_id":"experiment_run.run.batch.single_eligible.candidate.reviewed_80113e61","schema_version":"adaptive-runtime-experiment-run-v1","document_version":1,"content_sha256":"0d25d1bccbdc7c75af44f18da8f1fea25d2016aff88c20b06607dcc9a1829400"},"role":"experiment_run"},{"document_ref":{"document_id":"host_fingerprint.run.batch.single_eligible.candidate.reviewed_80113e61","schema_version":"adaptive-runtime-host-fingerprint-v1","document_version":1,"content_sha256":"ebf400273dffd5a26f80aa7cb681662a5f9fb39bbf97b341ffb92cb06c65ce30"},"role":"host_fingerprint"},{"document_ref":{"document_id":"manifest.experiment_plan.batch_actuation.v1.80113e613643","schema_version":"adaptive-runtime-compiled-execution-manifest-v1","document_version":1,"content_sha256":"8475f7c01282cf387a42cb45877de91bbf765429d715cfec4b15fe4587a8476b"},"role":"compiled_execution_manifest"},{"document_ref":{"document_id":"materialization.behavior.v3.operation_evidence.run.batch.single_eligible.candidate.reviewed_80113e61","schema_version":"adaptive-runtime-effective-behavior-materialization-v3","document_version":3,"content_sha256":"170e0e1aa806a4ff4784410f11efd316d56fe06e741507843570cee44409b19d"},"role":"behavior_materialization"},{"document_ref":{"document_id":"materialization.outcome.v2.operation_evidence.run.batch.single_eligible.candidate.reviewed_80113e61","schema_version":"adaptive-runtime-operation-outcome-materialization-v2","document_version":2,"content_sha256":"7ab530848ceece6daeb615fa7df9d26f7b6514874dcb6a119fec3be34240a2df"},"role":"outcome_materialization"},{"document_ref":{"document_id":"metrics.run.batch.single_eligible.candidate.reviewed_80113e61","schema_version":"adaptive-runtime-metric-observations-v1","document_version":1,"content_sha256":"d86a870b7bca3dbb6a35420446d4e85155035a286ce2f661a67a6a6de4a05050"},"role":"metric_observations"},{"document_ref":{"document_id":"operation_evidence.run.batch.single_eligible.candidate.reviewed_80113e61","schema_version":"adaptive-runtime-operation-evidence-v3","document_version":3,"content_sha256":"dc35effebe298ec60a1b6ffcceec7731f000352c94af496e766da86bc875d4b4"},"role":"operation_evidence"},{"document_ref":{"document_id":"validation.experiment_plan.batch_actuation.v1","schema_version":"adaptive-runtime-experiment-plan-validation-v1","document_version":1,"content_sha256":"10d564c7b8869e6a8e8acae76f3228a242d005534489850efc5cb9e74c0d5f5b"},"role":"plan_validation"},{"document_ref":{"document_id":"workload_instance.run.batch.single_eligible.candidate.reviewed_80113e61","schema_version":"adaptive-runtime-workload-instance-v1","document_version":1,"content_sha256":"df3c839b1a9dfe49987cd936ae21be78631e4ad37926d16f4c09f0a9b6eddb37"},"role":"workload_instance"},{"document_ref":{"document_id":"workload_shape.effective.run.batch.single_eligible.candidate.reviewed_80113e61","schema_version":"adaptive-runtime-workload-shape-v1","document_version":1,"content_sha256":"93efe292d6daf0bb5549909d3c7f736d933bf47802866dcf4502b558eff5f0ff"},"role":"effective_workload_shape"},{"document_ref":{"document_id":"workload_shape.requested.run.batch.single_eligible.candidate.reviewed_80113e61","schema_version":"adaptive-runtime-workload-shape-v1","document_version":1,"content_sha256":"c5e6d888377b4772833459637f078437cebed83b481ecbdeb9257cb85112bec1"},"role":"requested_workload_shape"}]},"performance_acceptance_authorization":false,"schema_version":"adaptive-runtime-artifact-inventory-v1","trace_references":{"architecture_ids":["ARC-QUIC-CRT-0104"],"requirement_ids":["REQ-QUIC-CRT-0218","REQ-QUIC-CRT-0219","REQ-QUIC-CRT-0220","REQ-QUIC-CRT-0221","REQ-QUIC-CRT-0222"],"verification_ids":["VER-QUIC-CRT-0106"],"work_item_ids":["WI-QUIC-CRT-0105"]}}