{"active_behavior_authorization":false,"content_sha256":"88fb681770167961f134163a7706b4c78ca127a9f9141279b388aa208bbb3b11","document_id":"artifact_inventory.closeout.fixture","document_version":1,"payload":{"artifacts":[{"document_ref":{"document_id":"adaptive_runtime_experiment_plan_send_composition_interaction_v1","schema_version":"adaptive-runtime-experiment-plan-v1","document_version":1,"content_sha256":"ee042716af3d91b00d1cf8ddc732bd978bdcef337b621a67c68274f88bd59bd2"},"role":"experiment_plan"},{"document_ref":{"document_id":"binary_cohort.closeout.fixture","schema_version":"adaptive-runtime-binary-cohort-v1","document_version":1,"content_sha256":"68a939dfc91559e6f0c864b01bbff72736dd1d7abb6eb3e1f0d83b64eb95f5fb"},"role":"binary_cohort"},{"document_ref":{"document_id":"classifications.closeout.fixture","schema_version":"adaptive-runtime-classification-set-v1","document_version":1,"content_sha256":"b2555b4c1cb07792b4b915f959fd76201283f9e5b8dfada9c07e8a47cbaaaac2"},"role":"classifications"},{"document_ref":{"document_id":"experiment_run.closeout.fixture","schema_version":"adaptive-runtime-experiment-run-v1","document_version":1,"content_sha256":"bbf2d93f8655c7fcfb8b50a365de1463930869690f3e27b8b0b8f3f3f275e587"},"role":"experiment_run"},{"document_ref":{"document_id":"host_fingerprint.closeout.fixture","schema_version":"adaptive-runtime-host-fingerprint-v1","document_version":1,"content_sha256":"ef1b428b0c8c52412ddf8d1d79ccf175f751118a358f33cbfea7d739ac11aa81"},"role":"host_fingerprint"},{"document_ref":{"document_id":"manifest.fixture.hardening_projection","schema_version":"adaptive-runtime-compiled-execution-manifest-v1","document_version":1,"content_sha256":"1af634164603da82360ca53626b3e4d7871f10e4b8ea58601b3bfcc404b1ace2"},"role":"compiled_execution_manifest"},{"document_ref":{"document_id":"materialization.behavior.v3.operation_evidence.closeout.fixture","schema_version":"adaptive-runtime-effective-behavior-materialization-v3","document_version":3,"content_sha256":"6b740d2847204eed394a666fa2c3460723f725c06ea7f7af78cd700d38a6eaf2"},"role":"behavior_materialization"},{"document_ref":{"document_id":"materialization.outcome.v2.operation_evidence.closeout.fixture","schema_version":"adaptive-runtime-operation-outcome-materialization-v2","document_version":2,"content_sha256":"e1708e38e2281c80688f8e142f584e174a6295465a7077c7c25b4d6cd852b755"},"role":"outcome_materialization"},{"document_ref":{"document_id":"metrics.closeout.fixture","schema_version":"adaptive-runtime-metric-observations-v1","document_version":1,"content_sha256":"7aa1501de80f1fa1ad348007da5a4fe37a48312849cdec63f9f0ff8c71463d80"},"role":"metric_observations"},{"document_ref":{"document_id":"operation_evidence.closeout.fixture","schema_version":"adaptive-runtime-operation-evidence-v3","document_version":3,"content_sha256":"05b7a634528b503a1cbbbaaea161b4d2d0204b6487f6cb2d6d19b06264a647fb"},"role":"operation_evidence"},{"document_ref":{"document_id":"validation.experiment_plan.send_composition_interaction.v1","schema_version":"adaptive-runtime-experiment-plan-validation-v2","document_version":2,"content_sha256":"9981a45d08e2192654a5e647f52dd1e65072ec37be64842119efdb70af51d49d"},"role":"plan_validation"},{"document_ref":{"document_id":"workload_instance.closeout.fixture","schema_version":"adaptive-runtime-workload-instance-v1","document_version":1,"content_sha256":"9169c23ba5255fb689df6c129dc32506e60b1e952586ac80c08c1445d72467f2"},"role":"workload_instance"},{"document_ref":{"document_id":"workload_shape.effective.closeout.fixture","schema_version":"adaptive-runtime-workload-shape-v1","document_version":1,"content_sha256":"9c1fa0273eae21bfb795057a36bfdf2c85ad6b8cc3241e79864a95ceeebc5a1d"},"role":"effective_workload_shape"},{"document_ref":{"document_id":"workload_shape.requested.closeout.fixture","schema_version":"adaptive-runtime-workload-shape-v1","document_version":1,"content_sha256":"b804bfde44cfce436f34ffd23d25424960bc2e334b37361661e8d9ed065b284e"},"role":"requested_workload_shape"}]},"performance_acceptance_authorization":false,"schema_version":"adaptive-runtime-artifact-inventory-v1","trace_references":{"architecture_ids":["ARC-QUIC-CRT-0101"],"requirement_ids":["REQ-QUIC-CRT-0214","REQ-QUIC-CRT-0215","REQ-QUIC-CRT-0216","REQ-QUIC-CRT-0217"],"verification_ids":["VER-QUIC-CRT-0103"],"work_item_ids":["WI-QUIC-CRT-0102"]}}