{"active_behavior_authorization":false,"content_sha256":"af4665c8508ec5399ccd0402fb8f511c0d8fdb00a5c9a6ab1e9ca63c1e096a58","document_id":"metrics.run.buffer.memory_conservative.candidate.reviewed_80113e61","document_version":1,"payload":{"metric_observations":[{"analytical_use":"correctness_only","connection_key":"connection.buffer.fallback","epoch_sequence":1,"metric_id":"metric.correctness.operation_count","run_id":"run.buffer.memory_conservative.candidate.reviewed_80113e61","value":1},{"analytical_use":"correctness_only","connection_key":"connection.buffer.inactive","epoch_sequence":1,"metric_id":"metric.correctness.operation_count","run_id":"run.buffer.memory_conservative.candidate.reviewed_80113e61","value":1},{"analytical_use":"correctness_only","connection_key":"connection.buffer.positive","epoch_sequence":1,"metric_id":"metric.correctness.operation_count","run_id":"run.buffer.memory_conservative.candidate.reviewed_80113e61","value":1},{"analytical_use":"correctness_only","connection_key":"connection.buffer.rollback","epoch_sequence":1,"metric_id":"metric.correctness.operation_count","run_id":"run.buffer.memory_conservative.candidate.reviewed_80113e61","value":1},{"analytical_use":"correctness_only","connection_key":"connection.buffer.shadow","epoch_sequence":1,"metric_id":"metric.correctness.operation_count","run_id":"run.buffer.memory_conservative.candidate.reviewed_80113e61","value":1}],"run_ref":{"document_id":"experiment_run.run.buffer.memory_conservative.candidate.reviewed_80113e61","schema_version":"adaptive-runtime-experiment-run-v1","document_version":1,"content_sha256":"b35cdc803667b77fde0ecc54982269a563f453d7383ad5e6fdab0e1ecb5768c7"}},"performance_acceptance_authorization":false,"schema_version":"adaptive-runtime-metric-observations-v1","trace_references":{"architecture_ids":["ARC-QUIC-CRT-0104"],"requirement_ids":["REQ-QUIC-CRT-0218","REQ-QUIC-CRT-0219","REQ-QUIC-CRT-0220","REQ-QUIC-CRT-0221","REQ-QUIC-CRT-0222"],"verification_ids":["VER-QUIC-CRT-0106"],"work_item_ids":["WI-QUIC-CRT-0105"]}}