{"active_behavior_authorization":false,"content_sha256":"445fd0866af33f412c011bfe9b2c44c41e84eb065265d5f8302dd8ed46cde295","document_id":"experiment_run.run.factor_onboarding.queued_send.single_datagram","document_version":1,"payload":{"binary_cohort_ref":{"document_id":"binary_cohort.run.factor_onboarding.queued_send.single_datagram","schema_version":"adaptive-runtime-binary-cohort-v1","document_version":1,"content_sha256":"8585991e22307792c14f4ce66f49c2db4ca225c1e9af99bfd560669146bcf48c"},"compiled_manifest_ref":{"document_id":"manifest.experiment_plan.queued_send.actuation.v1.de44bc6c4e4f","schema_version":"adaptive-runtime-compiled-execution-manifest-v2","document_version":2,"content_sha256":"00d079e8df3c9255c11dac13b57f76fa0bc80ff1c835f00c4b2aa7fb1296dd7d"},"host_fingerprint_ref":{"document_id":"host_fingerprint.run.factor_onboarding.queued_send.single_datagram","schema_version":"adaptive-runtime-host-fingerprint-v1","document_version":1,"content_sha256":"d1c5c93b1a8a0bf5b4a9db8a14c1881389c0dcf6f306cbd37e5a853eefb4a79b"},"run_id":"run.factor_onboarding.queued_send.single_datagram","workload_instance_ids":["workload.run.factor_onboarding.queued_send.single_datagram"]},"performance_acceptance_authorization":false,"schema_version":"adaptive-runtime-experiment-run-v1","trace_references":{"architecture_ids":["ARC-QUIC-CRT-0113"],"requirement_ids":["REQ-QUIC-CRT-0235","REQ-QUIC-CRT-0236","REQ-QUIC-CRT-0237","REQ-QUIC-CRT-0238","REQ-QUIC-CRT-0239","REQ-QUIC-CRT-0240"],"verification_ids":["VER-QUIC-CRT-0115"],"work_item_ids":["WI-QUIC-CRT-0114"]}}