{"active_behavior_authorization":false,"content_sha256":"9df7f708cda0574e7e977c350cc7e74c35fa519ad63f78915fe0c98d271a4014","document_id":"experiment_run.run.factor_onboarding.oversized_write.bounded_multi_fragment","document_version":1,"payload":{"binary_cohort_ref":{"document_id":"binary_cohort.run.factor_onboarding.oversized_write.bounded_multi_fragment","schema_version":"adaptive-runtime-binary-cohort-v1","document_version":1,"content_sha256":"9c5fcac77f4182be1167604f324bec000ae1738851802d66f4bb3cf9f36199b4"},"compiled_manifest_ref":{"document_id":"manifest.experiment_plan.oversized_write.bounded_multi_fragment.actuation.v1.de44bc6c4e4f","schema_version":"adaptive-runtime-compiled-execution-manifest-v2","document_version":2,"content_sha256":"a78ad39ce2be19b6e99130ce49f06fc241089f89023734d19b2e5ac0a16f7c98"},"host_fingerprint_ref":{"document_id":"host_fingerprint.run.factor_onboarding.oversized_write.bounded_multi_fragment","schema_version":"adaptive-runtime-host-fingerprint-v1","document_version":1,"content_sha256":"784bacb0482c179c6d0894c9185a8767e1dbbae321bb9c62cf990284088f5924"},"run_id":"run.factor_onboarding.oversized_write.bounded_multi_fragment","workload_instance_ids":["workload.run.factor_onboarding.oversized_write.bounded_multi_fragment"]},"performance_acceptance_authorization":false,"schema_version":"adaptive-runtime-experiment-run-v1","trace_references":{"architecture_ids":["ARC-QUIC-CRT-0113"],"requirement_ids":["REQ-QUIC-CRT-0235","REQ-QUIC-CRT-0236","REQ-QUIC-CRT-0237","REQ-QUIC-CRT-0238","REQ-QUIC-CRT-0239","REQ-QUIC-CRT-0240"],"verification_ids":["VER-QUIC-CRT-0115"],"work_item_ids":["WI-QUIC-CRT-0114"]}}