{"active_behavior_authorization":false,"content_sha256":"8606e2ff6af242db0b614c82ef8e045ebb70c59b475b08f0793f5345013de64b","document_id":"artifact_inventory.run.runtime_proof_capture.queued-single","document_version":1,"payload":{"artifacts":[{"document_ref":{"document_id":"adaptive_runtime_queued_send_actuation_plan_v1","schema_version":"adaptive-runtime-experiment-plan-v1","document_version":1,"content_sha256":"a33415277270991cb6c81d5ec9b762ac729627e1161df8437fa77ba592aa8262"},"role":"experiment_plan"},{"document_ref":{"document_id":"binary_cohort.run.runtime_proof_capture.queued-single","schema_version":"adaptive-runtime-binary-cohort-v1","document_version":1,"content_sha256":"578cc95876a74abdb9635931bb5c5bae3c807814ce4a506e14baa674add5fe86"},"role":"binary_cohort"},{"document_ref":{"document_id":"classifications.run.runtime_proof_capture.queued-single","schema_version":"adaptive-runtime-classification-set-v1","document_version":1,"content_sha256":"951672254042c9cb6e53d4a55d3c69275767ae36141433bf7b9e26ef3d7382fd"},"role":"classifications"},{"document_ref":{"document_id":"experiment_run.run.runtime_proof_capture.queued-single","schema_version":"adaptive-runtime-experiment-run-v1","document_version":1,"content_sha256":"50d5420352113dba82f3841a25b704e84e91c376985bf9dc84e1538d6076ba5a"},"role":"experiment_run"},{"document_ref":{"document_id":"host_fingerprint.run.runtime_proof_capture.queued-single","schema_version":"adaptive-runtime-host-fingerprint-v1","document_version":1,"content_sha256":"a6db189c210b3047df41144d25a6a583d33c48fc5a0bffc526df70b054053bb2"},"role":"host_fingerprint"},{"document_ref":{"document_id":"manifest.experiment_plan.queued_send.actuation.v1.8d510a34737c","schema_version":"adaptive-runtime-compiled-execution-manifest-v2","document_version":2,"content_sha256":"cd19b22494dd1ec7dcb20df15e253b02022cfb7a9cbfb67dc1610a427a8b072d"},"role":"compiled_execution_manifest"},{"document_ref":{"document_id":"materialization.behavior.v3.operation_evidence.run.runtime_proof_capture.queued-single","schema_version":"adaptive-runtime-effective-behavior-materialization-v3","document_version":3,"content_sha256":"76f1b7b6ed9ebfeeae7d828e726bbc1c4e093a2e794eb01e6e6711622a54479c"},"role":"behavior_materialization"},{"document_ref":{"document_id":"materialization.outcome.v2.operation_evidence.run.runtime_proof_capture.queued-single","schema_version":"adaptive-runtime-operation-outcome-materialization-v2","document_version":2,"content_sha256":"1f0d4244128d6d6dee88af64035fad634bb3a177750bc824e8e7ca207909ffec"},"role":"outcome_materialization"},{"document_ref":{"document_id":"metrics.run.runtime_proof_capture.queued-single","schema_version":"adaptive-runtime-metric-observations-v1","document_version":1,"content_sha256":"baa924781724dda5d6a0b0eebfce08b70b8eea676e40dd817301eb53669fe86b"},"role":"metric_observations"},{"document_ref":{"document_id":"operation_evidence.run.runtime_proof_capture.queued-single","schema_version":"adaptive-runtime-operation-evidence-v4","document_version":4,"content_sha256":"aafa8b02ba2ec3d2350c2a385cac4aca0a1db3047ddba6ca91de0806916d26de"},"role":"operation_evidence"},{"document_ref":{"document_id":"validation.experiment_plan.queued_send.actuation.v1","schema_version":"adaptive-runtime-experiment-plan-validation-v3","document_version":3,"content_sha256":"8201064018f901e5a1340593aaa36aec3d7363c03f32122f841429b0db2aa286"},"role":"plan_validation"},{"document_ref":{"document_id":"workload_instance.run.runtime_proof_capture.queued-single","schema_version":"adaptive-runtime-workload-instance-v1","document_version":1,"content_sha256":"445b313f5843a463cd0682c92ef86c8380ce3f83bd1d4c2cc20fb6aecb93b717"},"role":"workload_instance"},{"document_ref":{"document_id":"workload_shape.effective.run.runtime_proof_capture.queued-single","schema_version":"adaptive-runtime-workload-shape-v1","document_version":1,"content_sha256":"21c0529d42364bb7522cfa7cb174f3b448173331851780f070f5340d0f6764ea"},"role":"effective_workload_shape"},{"document_ref":{"document_id":"workload_shape.requested.run.runtime_proof_capture.queued-single","schema_version":"adaptive-runtime-workload-shape-v1","document_version":1,"content_sha256":"4078ec791f87977875ed55fc4f226f4056bbbff6a4f510058bed5527d1844b46"},"role":"requested_workload_shape"}]},"performance_acceptance_authorization":false,"schema_version":"adaptive-runtime-artifact-inventory-v1","trace_references":{"architecture_ids":["ARC-QUIC-CRT-0113"],"requirement_ids":["REQ-QUIC-CRT-0235","REQ-QUIC-CRT-0236","REQ-QUIC-CRT-0237","REQ-QUIC-CRT-0238","REQ-QUIC-CRT-0239","REQ-QUIC-CRT-0240"],"verification_ids":["VER-QUIC-CRT-0115"],"work_item_ids":["WI-QUIC-CRT-0114"]}}