{"active_behavior_authorization":false,"content_sha256":"617d5e18b2d08f4531fd7c1ae9178fefe951cb17f92c2f1effff6a9ac52d4f2b","document_id":"classifications.run.factor_onboarding.oversized_write.single_fragment","document_version":1,"payload":{"classifications":[{"classification_id":"classification.oversized_write_admission_quantum.connection.oversized_write.single_fragment.fallback.fallback","kind":"fallback","reason_code":"reason.fallback","retained":true,"target":{"axis_id":"oversized_write_admission_quantum","connection_key":"connection.oversized_write.single_fragment.fallback","decision_instance_id":103,"epoch_sequence":1,"operation_id":103,"run_id":"run.factor_onboarding.oversized_write.single_fragment","target_kind":"operation"}},{"classification_id":"classification.oversized_write_admission_quantum.connection.oversized_write.single_fragment.inactive.inactive","kind":"inactive","reason_code":"reason.inactive","retained":true,"target":{"axis_id":"oversized_write_admission_quantum","connection_key":"connection.oversized_write.single_fragment.inactive","decision_instance_id":102,"epoch_sequence":1,"operation_id":102,"run_id":"run.factor_onboarding.oversized_write.single_fragment","target_kind":"operation"}},{"classification_id":"classification.oversized_write_admission_quantum.connection.oversized_write.single_fragment.positive.analytically_eligible","kind":"analytically_eligible","reason_code":"reason.analytically_eligible","retained":true,"target":{"axis_id":"oversized_write_admission_quantum","connection_key":"connection.oversized_write.single_fragment.positive","decision_instance_id":101,"epoch_sequence":1,"operation_id":101,"run_id":"run.factor_onboarding.oversized_write.single_fragment","target_kind":"operation"}},{"classification_id":"classification.oversized_write_admission_quantum.connection.oversized_write.single_fragment.rollback.analytically_eligible","kind":"analytically_eligible","reason_code":"reason.analytically_eligible","retained":true,"target":{"axis_id":"oversized_write_admission_quantum","connection_key":"connection.oversized_write.single_fragment.rollback","decision_instance_id":105,"epoch_sequence":1,"operation_id":105,"run_id":"run.factor_onboarding.oversized_write.single_fragment","target_kind":"operation"}},{"classification_id":"classification.oversized_write_admission_quantum.connection.oversized_write.single_fragment.shadow.analytically_eligible","kind":"analytically_eligible","reason_code":"reason.analytically_eligible","retained":true,"target":{"axis_id":"oversized_write_admission_quantum","connection_key":"connection.oversized_write.single_fragment.shadow","decision_instance_id":104,"epoch_sequence":1,"operation_id":104,"run_id":"run.factor_onboarding.oversized_write.single_fragment","target_kind":"operation"}}],"compatibility_catalog_ref":{"document_id":"adaptive_runtime_classification_compatibility_catalog_v1","schema_version":"adaptive-runtime-classification-compatibility-catalog-v1","document_version":1,"content_sha256":"d659293d04ee2d69dbe7592b3efada8bc058aa138f52a2dd625368169b8439ca"},"evidence_ref":{"document_id":"operation_evidence.run.factor_onboarding.oversized_write.single_fragment","schema_version":"adaptive-runtime-operation-evidence-v4","document_version":4,"content_sha256":"2ca6720df12ebfa7d0a6d8a3708fc377ed1108161760c28b4034ce3206900f39"}},"performance_acceptance_authorization":false,"schema_version":"adaptive-runtime-classification-set-v1","trace_references":{"architecture_ids":["ARC-QUIC-CRT-0113"],"requirement_ids":["REQ-QUIC-CRT-0235","REQ-QUIC-CRT-0236","REQ-QUIC-CRT-0237","REQ-QUIC-CRT-0238","REQ-QUIC-CRT-0239","REQ-QUIC-CRT-0240"],"verification_ids":["VER-QUIC-CRT-0115"],"work_item_ids":["WI-QUIC-CRT-0114"]}}