{"active_behavior_authorization":false,"content_sha256":"6b7daac8ebac7009eed7b70f9e04885f964da6dc2fc3e05ccde85ddd41927a8d","document_id":"host_fingerprint.run.buffer.memory_conservative.candidate.reviewed_80113e61","document_version":1,"payload":{"fingerprint_id":"host.0080d5b929520780449ad8cd","manifest_ref":{"document_id":"manifest.experiment_plan.buffer_actuation.v1.80113e613643","schema_version":"adaptive-runtime-compiled-execution-manifest-v1","document_version":1,"content_sha256":"9f148119667c9b7bb350e70de83d64c051085d68533f3e940aa2dec6d7e720de"},"os_architecture":"x64","os_platform":"Microsoft Windows 10.0.26200","physical_host_id":"unavailable_from_guest","resolved_capabilities":["adaptive_runtime_internal_forced_mode"],"vm_id":"78848434-7c6c-4836-b04b-845540f2b138"},"performance_acceptance_authorization":false,"schema_version":"adaptive-runtime-host-fingerprint-v1","trace_references":{"architecture_ids":["ARC-QUIC-CRT-0104"],"requirement_ids":["REQ-QUIC-CRT-0218","REQ-QUIC-CRT-0219","REQ-QUIC-CRT-0220","REQ-QUIC-CRT-0221","REQ-QUIC-CRT-0222"],"verification_ids":["VER-QUIC-CRT-0106"],"work_item_ids":["WI-QUIC-CRT-0105"]}}