{"active_behavior_authorization":false,"content_sha256":"e7e23464b89d4760efffec27d3fad76b8d376dcad5181e5ef1908824292ca54e","document_id":"workload_shape.effective.run.runtime_proof_capture.oversized-single","document_version":1,"payload":{"concurrency":1,"operation_count":5,"payload_bytes":65536,"shape_kind":"effective","workload_archetype_id":"send_composition_independent_correctness_harness","workload_instance_id":"workload.run.runtime_proof_capture.oversized-single"},"performance_acceptance_authorization":false,"schema_version":"adaptive-runtime-workload-shape-v1","trace_references":{"architecture_ids":["ARC-QUIC-CRT-0113"],"requirement_ids":["REQ-QUIC-CRT-0235","REQ-QUIC-CRT-0236","REQ-QUIC-CRT-0237","REQ-QUIC-CRT-0238","REQ-QUIC-CRT-0239","REQ-QUIC-CRT-0240"],"verification_ids":["VER-QUIC-CRT-0115"],"work_item_ids":["WI-QUIC-CRT-0114"]}}