{"active_behavior_authorization":false,"content_sha256":"3a4d518052bfb29789e6d7ff35ef00bfbc9932cf1491721c38a782250a13cd2a","document_id":"binary_cohort.run.buffer.memory_conservative.candidate.reviewed_80113e61","document_version":1,"payload":{"binary_cohort_id":"binary.independent_actuation_proof.reviewed_80113e61","binary_path":"C:\\shared\\src\\incursa\\.worktrees\\quic-send-composition-correctness-20260726\\tests\\Incursa.Quic.Tests\\bin\\Release\\net10.0\\Incursa.Quic.Tests.dll","binary_sha256":"fa51870fe039af36d755357458e54b68dfa9ac30fa5342f551e15976a7285751","manifest_ref":{"document_id":"manifest.experiment_plan.buffer_actuation.v1.80113e613643","schema_version":"adaptive-runtime-compiled-execution-manifest-v1","document_version":1,"content_sha256":"9f148119667c9b7bb350e70de83d64c051085d68533f3e940aa2dec6d7e720de"},"runner_sha256":"8737aa78bdbe2941083c2c3674da3a9c3ab4cabd2cac040d39d1d0c19f9fc20d","runner_version":"powershell.7.6.3","source_commit":"80113e613643fd1fdbed38cde42efdc5244401eb"},"performance_acceptance_authorization":false,"schema_version":"adaptive-runtime-binary-cohort-v1","trace_references":{"architecture_ids":["ARC-QUIC-CRT-0104"],"requirement_ids":["REQ-QUIC-CRT-0218","REQ-QUIC-CRT-0219","REQ-QUIC-CRT-0220","REQ-QUIC-CRT-0221","REQ-QUIC-CRT-0222"],"verification_ids":["VER-QUIC-CRT-0106"],"work_item_ids":["WI-QUIC-CRT-0105"]}}