{"active_behavior_authorization":false,"content_sha256":"578cc95876a74abdb9635931bb5c5bae3c807814ce4a506e14baa674add5fe86","document_id":"binary_cohort.run.runtime_proof_capture.queued-single","document_version":1,"payload":{"binary_cohort_id":"binary.runtime_proof_capture.correctness","binary_path":"C:\\shared\\temp\\quic-dotnet-worktrees\\runtime-proof-capture-20260727\\src\\Incursa.Quic\\bin\\Release\\net10.0\\Incursa.Quic.dll","binary_sha256":"1668b59c8f50f7a5c74aae12b20cdbec4cf38fd2afa9e1e1808a0669d4955bfa","manifest_ref":{"document_id":"manifest.experiment_plan.queued_send.actuation.v1.8d510a34737c","schema_version":"adaptive-runtime-compiled-execution-manifest-v2","document_version":2,"content_sha256":"cd19b22494dd1ec7dcb20df15e253b02022cfb7a9cbfb67dc1610a427a8b072d"},"runner_sha256":"b3b74bbc1e709cef7b7c34bdd62b63a1fddb62cab0a0cd9c1cbbdd6fd05f16b8","runner_version":"runtime-proof-capture-v1","source_commit":"8d510a34737c2c475b36199af2e089043c6d4213"},"performance_acceptance_authorization":false,"schema_version":"adaptive-runtime-binary-cohort-v1","trace_references":{"architecture_ids":["ARC-QUIC-CRT-0113"],"requirement_ids":["REQ-QUIC-CRT-0235","REQ-QUIC-CRT-0236","REQ-QUIC-CRT-0237","REQ-QUIC-CRT-0238","REQ-QUIC-CRT-0239","REQ-QUIC-CRT-0240"],"verification_ids":["VER-QUIC-CRT-0115"],"work_item_ids":["WI-QUIC-CRT-0114"]}}