{"active_behavior_authorization":false,"content_sha256":"b50b6b5445acaf3117f094cfeb866c38a6a0749c6136574e6ab7f69336d45d8c","document_id":"binary_cohort.run.send_admission_composition.correctness.a1","document_version":1,"payload":{"binary_cohort_id":"binary_cohort.run.send_admission_composition.correctness.a1","binary_path":"C:\\shared\\temp\\quic-dotnet-worktrees\\adaptive-runtime-reviewed-admission-interaction-20260727\\src\\Incursa.Quic\\bin\\Release\\net10.0\\Incursa.Quic.dll","binary_sha256":"b656cc576bb8343197730b688ab9f4a1bea6cdbd24c87534127468be6c8137f8","manifest_ref":{"document_id":"manifest.adaptive_runtime_send_admission_correctness_plan_v1.42ec5cc5f06b","schema_version":"adaptive-runtime-send-admission-compiled-manifest-v1","document_version":1,"content_sha256":"35c8186ac8af468cd0acf879010ceefc70fb37254694382cffb5b9f3feb0e271"},"runner_sha256":"57d9441522bda51a1df283652710fc970733542d216badb958dad3559059d0b2","runner_version":"incursa_quic_tests.release.net10","source_commit":"42ec5cc5f06bbb51bab2d864c79b4c77df2f83f2"},"performance_acceptance_authorization":false,"schema_version":"adaptive-runtime-binary-cohort-v1","trace_references":{"architecture_ids":["ARC-QUIC-CRT-0116"],"requirement_ids":["REQ-QUIC-CRT-0241","REQ-QUIC-CRT-0242","REQ-QUIC-CRT-0243","REQ-QUIC-CRT-0244","REQ-QUIC-CRT-0245","REQ-QUIC-CRT-0246"],"verification_ids":["VER-QUIC-CRT-0118"],"work_item_ids":["WI-QUIC-CRT-0117"]}}