{"active_behavior_authorization":false,"content_sha256":"e56b6315a2d86f48548456590c711b221cb00a004686d4e02e3cdbeee7b033b7","document_id":"workload_instance.run.send_admission_composition.correctness.a3","document_version":1,"payload":{"effective_shape_ref":{"document_id":"workload_shape.effective.run.send_admission_composition.correctness.a3","schema_version":"adaptive-runtime-workload-shape-v1","document_version":1,"content_sha256":"dc3d76c827d36772fb93f19384f9d797196496b43842dac15d6a41a2dbdedd89"},"requested_shape_ref":{"document_id":"workload_shape.requested.run.send_admission_composition.correctness.a3","schema_version":"adaptive-runtime-workload-shape-v1","document_version":1,"content_sha256":"5adcbf216b16212d7dd668ba766e96fb3efa905c33113ec5a88aecca7e5e1ef3"},"run_ref":{"document_id":"experiment_run.run.send_admission_composition.correctness.a3","schema_version":"adaptive-runtime-experiment-run-v1","document_version":1,"content_sha256":"4fb6f6fde54c1f20dcb27cb22aee2f4622519d46b48533bf126e9d47ca8cff88"},"workload_instance_id":"workload.run.send_admission_composition.correctness.a3"},"performance_acceptance_authorization":false,"schema_version":"adaptive-runtime-workload-instance-v1","trace_references":{"architecture_ids":["ARC-QUIC-CRT-0116"],"requirement_ids":["REQ-QUIC-CRT-0241","REQ-QUIC-CRT-0242","REQ-QUIC-CRT-0243","REQ-QUIC-CRT-0244","REQ-QUIC-CRT-0245","REQ-QUIC-CRT-0246"],"verification_ids":["VER-QUIC-CRT-0118"],"work_item_ids":["WI-QUIC-CRT-0117"]}}