{"active_behavior_authorization":false,"content_sha256":"7a0a7dc49679175bd9459117382bd3ef97de4a8ca1e5a9b99571e8eb9d7e1f0b","document_id":"host_fingerprint.run.send_composition.correctness","document_version":1,"payload":{"fingerprint_id":"host.0080d5b929520780449ad8cd","manifest_ref":{"document_id":"manifest.experiment_plan.send_composition_correctness.v1.87243f471bb1","schema_version":"adaptive-runtime-compiled-execution-manifest-v1","document_version":1,"content_sha256":"b7fdc2184c015c3917c30cffbf2e8faf35305cb0511c06fe51b0fe789e53d770"},"os_architecture":"x64","os_platform":"Microsoft Windows 10.0.26200","physical_host_id":"unavailable_from_guest","resolved_capabilities":["adaptive_runtime_internal_forced_mode","adaptive_runtime_send_composition_correctness"],"vm_id":"78848434-7c6c-4836-b04b-845540f2b138"},"performance_acceptance_authorization":false,"schema_version":"adaptive-runtime-host-fingerprint-v1","trace_references":{"architecture_ids":["ARC-QUIC-CRT-0107"],"requirement_ids":["REQ-QUIC-CRT-0223","REQ-QUIC-CRT-0224","REQ-QUIC-CRT-0225","REQ-QUIC-CRT-0226","REQ-QUIC-CRT-0227","REQ-QUIC-CRT-0228"],"verification_ids":["VER-QUIC-CRT-0109"],"work_item_ids":["WI-QUIC-CRT-0108"]}}