{"active_behavior_authorization":false,"content_sha256":"f948578ec1b0e9df64becdeee5b339d0ab7b1f6303a0656a2ec7f273099d54e9","document_id":"experiment_run.run.factor_onboarding.oversized_write.single_fragment","document_version":1,"payload":{"binary_cohort_ref":{"document_id":"binary_cohort.run.factor_onboarding.oversized_write.single_fragment","schema_version":"adaptive-runtime-binary-cohort-v1","document_version":1,"content_sha256":"ab59b3f83a5ccf0f021a147c369ea3160a239968a0c1fbc1f594da51725cc66f"},"compiled_manifest_ref":{"document_id":"manifest.experiment_plan.oversized_write.single_fragment.actuation.v1.de44bc6c4e4f","schema_version":"adaptive-runtime-compiled-execution-manifest-v2","document_version":2,"content_sha256":"d9f37d38982c36fd15351148975e9c6ee08660fd896cb2f9dc290e643561dc7c"},"host_fingerprint_ref":{"document_id":"host_fingerprint.run.factor_onboarding.oversized_write.single_fragment","schema_version":"adaptive-runtime-host-fingerprint-v1","document_version":1,"content_sha256":"188f553d1d11b26c5ca807f879a69718608a12d0e309d30266c3ab1dfc5c1086"},"run_id":"run.factor_onboarding.oversized_write.single_fragment","workload_instance_ids":["workload.run.factor_onboarding.oversized_write.single_fragment"]},"performance_acceptance_authorization":false,"schema_version":"adaptive-runtime-experiment-run-v1","trace_references":{"architecture_ids":["ARC-QUIC-CRT-0113"],"requirement_ids":["REQ-QUIC-CRT-0235","REQ-QUIC-CRT-0236","REQ-QUIC-CRT-0237","REQ-QUIC-CRT-0238","REQ-QUIC-CRT-0239","REQ-QUIC-CRT-0240"],"verification_ids":["VER-QUIC-CRT-0115"],"work_item_ids":["WI-QUIC-CRT-0114"]}}