{"active_behavior_authorization":false,"content_sha256":"a6db189c210b3047df41144d25a6a583d33c48fc5a0bffc526df70b054053bb2","document_id":"host_fingerprint.run.runtime_proof_capture.queued-single","document_version":1,"payload":{"fingerprint_id":"host.0080d5b929520780449ad8cd","manifest_ref":{"document_id":"manifest.experiment_plan.queued_send.actuation.v1.8d510a34737c","schema_version":"adaptive-runtime-compiled-execution-manifest-v2","document_version":2,"content_sha256":"cd19b22494dd1ec7dcb20df15e253b02022cfb7a9cbfb67dc1610a427a8b072d"},"os_architecture":"x64","os_platform":"Microsoft Windows 10.0.26200","physical_host_id":"unavailable_from_guest","resolved_capabilities":["adaptive_runtime_internal_forced_mode","single_behavior_distinct_axis_only"],"vm_id":"78848434-7c6c-4836-b04b-845540f2b138"},"performance_acceptance_authorization":false,"schema_version":"adaptive-runtime-host-fingerprint-v1","trace_references":{"architecture_ids":["ARC-QUIC-CRT-0113"],"requirement_ids":["REQ-QUIC-CRT-0235","REQ-QUIC-CRT-0236","REQ-QUIC-CRT-0237","REQ-QUIC-CRT-0238","REQ-QUIC-CRT-0239","REQ-QUIC-CRT-0240"],"verification_ids":["VER-QUIC-CRT-0115"],"work_item_ids":["WI-QUIC-CRT-0114"]}}