{"active_behavior_authorization":false,"content_sha256":"5bc3c076fc6ea593a0cb4b4585c70aae19f2ec2e9369dbcad2c56661050e2170","document_id":"workload_instance.run.send_admission_composition.correctness.a6","document_version":1,"payload":{"effective_shape_ref":{"document_id":"workload_shape.effective.run.send_admission_composition.correctness.a6","schema_version":"adaptive-runtime-workload-shape-v1","document_version":1,"content_sha256":"d26a4364f0f4d3f73d8b9bd489ecff3a42145e0ac7354244e331ee7b6db994fe"},"requested_shape_ref":{"document_id":"workload_shape.requested.run.send_admission_composition.correctness.a6","schema_version":"adaptive-runtime-workload-shape-v1","document_version":1,"content_sha256":"27bb14f3e5b2dce5bef5c11455edd352ae22ff26a3a89588820ffceb4f36e197"},"run_ref":{"document_id":"experiment_run.run.send_admission_composition.correctness.a6","schema_version":"adaptive-runtime-experiment-run-v1","document_version":1,"content_sha256":"73dab2ff838ab1521923e12f5965c95b1a3efa853a0bc2c37725227efaca13ca"},"workload_instance_id":"workload.run.send_admission_composition.correctness.a6"},"performance_acceptance_authorization":false,"schema_version":"adaptive-runtime-workload-instance-v1","trace_references":{"architecture_ids":["ARC-QUIC-CRT-0116"],"requirement_ids":["REQ-QUIC-CRT-0241","REQ-QUIC-CRT-0242","REQ-QUIC-CRT-0243","REQ-QUIC-CRT-0244","REQ-QUIC-CRT-0245","REQ-QUIC-CRT-0246"],"verification_ids":["VER-QUIC-CRT-0118"],"work_item_ids":["WI-QUIC-CRT-0117"]}}